{
  "checkpoint_id": "INT-20260403T115839Z",
  "phase": "C4-first-generic-product-proof",
  "cycle_id": null,
  "source_commits": [
    "2799941",
    "4f43c0d",
    "b940d26"
  ],
  "rollback_point": "cf7b49ee7e3dad686427ec3326da6a8152a4c0e8",
  "qa_verdict": {
    "candidate_branch": "codex/integration",
    "candidate_commit": "5df48da0befaedd0d6c5ba0fbd169b35eb63f31f",
    "build": "pass",
    "parser": "pass",
    "layout": {
      "home": {
        "critical": 0,
        "major": 0,
        "minor": 0,
        "cosmetic": 12
      },
      "imc": {
        "critical": 0,
        "major": 0,
        "minor": 0,
        "cosmetic": 14
      },
      "kernel": {
        "/work/xr": {
          "critical": 0,
          "major": 0,
          "minor": 0
        },
        "/work/ft": {
          "critical": 0,
          "major": 0,
          "minor": 0
        }
      }
    },
    "responsive": {
      "overflow_hits": 0,
      "report": "../worktrees/integration/deterministic-design-system/reports/responsive/responsive.verification.md"
    },
    "law_compliance": {
      "product_kernel": {
        "/work/xr": {
          "critical": 0,
          "major": 0,
          "minor": 0
        },
        "/work/ft": {
          "critical": 0,
          "major": 0,
          "minor": 0
        }
      }
    },
    "recommendation": "accept"
  },
  "status": "accepted",
  "full_qa_bundle": "CLAW/control-plane/reports/W4-integration-replay.md",
  "recovery_verdict": null,
  "open_blockers": [],
  "best_known_state": "5df48da0befaedd0d6c5ba0fbd169b35eb63f31f",
  "created_at": "2026-04-03T11:58:39Z"
}
